<?xml version="1.0" encoding="UTF-8"?>
<xsd:schema xmlns:xsd="http://www.w3.org/2001/XMLSchema"
	xsi:noNamespaceSchemaLocation="sales-form.xsd"
	xmlns:xsi="http://www.w3.org/2001/XMLSchema-instance">

	<xsd:element name="sales">
		<xsd:complexType>
			<xsd:sequence>
				<xsd:element name="paymentForm" type="xsd:string" />
				<xsd:element name="products">
					<xsd:complexType>
						<xsd:sequence>
							<xsd:element ref="product" maxOccurs="unbounded" />
						</xsd:sequence>
					</xsd:complexType>
				</xsd:element>
			</xsd:sequence>
			<xsd:attribute name="currency" type="xsd:string" />
		</xsd:complexType>
	</xsd:element>

	<xsd:element name="product">
		<xsd:complexType>
			<xsd:sequence>
				<xsd:element name="name" type="xsd:string" />
				<xsd:element name="price" type="xsd:double" />
			</xsd:sequence>
		</xsd:complexType>
	</xsd:element>

</xsd:schema>